PID,location_id,StateFIPS,StatePostal,StateName,StatePolicy,Mandate,StateWide,SWGeo,SWPop,DateIssued,DateEnacted,DateExpiry,DateEnded,Extends,Expands,Eases,Ends,Depends,PolicyCodingNotes,PolicySource,PolicySourceID,LastUpdated,LastUpdatedNotes,UpdatingSource1,UpdatingSource2
MO0025,548,29,MO,Missouri,StayAtHome,1,1,1,1,20200427,20200504,,,,,,MO0015,,Ends stay at home order. Encourages continued social distancing,https://health.mo.gov/living/healthcondiseases/communicable/novel-coronavirus/pdf/economic-reopening.pdf,Missouri0007,20200429,,https://governor.mo.gov/actions/executive-orders,https://health.mo.gov/living/healthcondiseases/communicable/novel-coronavirus/statewide-orders.php
MT0001,549,30,MT,Montana,EmergDec,1,1,1,1,20200312,20200312,,,,,,,,State of Emergency declaration. Does not appear to include formal expiry.,http://governor.mt.gov/Portals/16/docs/2020EOs/EO-02-2020_COVID-19%20Emergency%20Declaration.pdf?ver=2020-03-13-103433-047,Montana0001,20200324,,https://news.mt.gov/,https://covid19.mt.gov/
MT0002,549,30,MT,Montana,GathRecomAny,0,1,1,1,20200315,20200315,,,,,,,,"Strongly recommends limiting all gatherings, especially those gatherings of more than 50 people. Not a formal restriction.",http://governor.mt.gov/Portals/16/2020-03-15_Governor%20Directive%20re%20COVID-19.pdf?ver=2020-03-15-170323-930,Montana0002,20200324,,https://news.mt.gov/,https://covid19.mt.gov/
MT0003,549,30,MT,Montana,SchoolClose,1,1,1,1,20200315,20200315,20200328,,,,,,,"All non-residential public schools are closed through 20200327, so expiry is 20200328. EO indicates effective immediately, while press release indicates starting on 20200316.",http://governor.mt.gov/Portals/16/2020-03-15_Governor%20Directive%20re%20COVID-19.pdf?ver=2020-03-15-170323-930,Montana0002,20200427,Updated DateExpiry to 20200328 as schools are to be closed through 20200327,https://news.mt.gov/,https://covid19.mt.gov/
MT0004,549,30,MT,Montana,OtherBusinessClose,1,1,1,1,20200320,20200320,20200328,,,,,,,"Closure required: casinos, fitness centers, entertainment venues, indoor facilities in ski areas, bowling alleys, music halls. In effect at 8 pm on 20200320. Initial expiry is 20200327 at 1159 pm, so 20200328. http://governor.mt.gov/Portals/16/Closure%20Extensions%20and%20Social%20Distancing.pdf?ver=2020-03-24-164313-497",http://governor.mt.gov/Portals/16/Directive%20on%20Bars%20and%20Restaurants.pdf?ver=2020-03-20-101314-937,Montana0003,20200427,Updated DateExpiry to 20200328,https://news.mt.gov/,https://covid19.mt.gov/
MT0005,549,30,MT,Montana,RestaurantRestrict,1,1,1,1,20200320,20200320,20200328,,,,,,,"Limited operations required (delivery, window service, drive through): restaurants, bars, food establishments. In effect at 8 pm on 20200320, Initial expiry is 20200327 at 1159 pm, so 20200328. ",http://governor.mt.gov/Portals/16/Directive%20on%20Bars%20and%20Restaurants.pdf?ver=2020-03-20-101314-937,Montana0003,20200427,Updated DateExpiry to 20200328,https://news.mt.gov/,https://covid19.mt.gov/
MT0006,549,30,MT,Montana,GathRestrict10,1,1,1,1,20200324,20200324,,,,,,,,Non-essential social and recreational gatherings greater than 10 are prohibited immediately. No clearcut expiries (expires with State of Emergency),http://governor.mt.gov/Portals/16/Closure%20Extensions%20and%20Social%20Distancing.pdf?ver=2020-03-24-164313-497,Montana0004,20200326,,https://news.mt.gov/,https://covid19.mt.gov/
MT0007,549,30,MT,Montana,GathRestrictAny,1,1,1,1,20200324,20200324,,,,MT0002,,,,Non-essential social and recreational gatherings greater than 10 are prohibited immediately. Expands the GathRecomAny under PID MT0002.  No clearcut expiries (expires with State of Emergency),http://governor.mt.gov/Portals/16/Closure%20Extensions%20and%20Social%20Distancing.pdf?ver=2020-03-24-164313-497,Montana0004,20200403,,https://news.mt.gov/,https://covid19.mt.gov/
MT0011,549,30,MT,Montana,SchoolClose,1,1,1,1,20200324,20200324,20200411,,MT0003,,,,,"Non-residential public school closure extended through 20200410, so expiry is 20200411",http://governor.mt.gov/Portals/16/Closure%20Extensions%20and%20Social%20Distancing.pdf?ver=2020-03-24-164313-497,Montana0004,20200427,,https://news.mt.gov/,https://covid19.mt.gov/
MT0012,549,30,MT,Montana,OtherBusinessClose,1,1,1,1,20200324,20200328,20200411,,MT0004,,,,,"Extends closure of businesses under PID MT0004 through 20200410, so expiry is 20200411. Montana is treating these through separate EOs than the NEBusinessClose so coding accordingly",http://governor.mt.gov/Portals/16/Closure%20Extensions%20and%20Social%20Distancing.pdf?ver=2020-03-24-164313-497,Montana0004,20200427,,https://news.mt.gov/,https://covid19.mt.gov/
MT0013,549,30,MT,Montana,RestaurantRestrict,1,1,1,1,20200324,20200328,20200411,,MT0005,,,,,"Extends limited operations of restaurants under PID MT0005 through 20200410, so expiry is 20200411",http://governor.mt.gov/Portals/16/Closure%20Extensions%20and%20Social%20Distancing.pdf?ver=2020-03-24-164313-497,Montana0004,20200427,,https://news.mt.gov/,https://covid19.mt.gov/
MT0008,549,30,MT,Montana,NEBusinessClose,1,1,1,1,20200326,20200328,20200411,,MT0012,MT0012,,,,"(quote) All businesses and opreations in the State, except Esssential Businesses and Operations as defined below, are required to cease all activities (quote). In effect at 1201 am 20200328, initial expiry is through 20200410 (so coded to 20200411) Expands MT0012 other business closure.",https://covid19.mt.gov/Portals/223/Documents/Stay%20at%20Home%20Directive.pdf?ver=2020-03-26-173332-177,Montana0005,20200427,Updated DateExpiry to 20200411,https://news.mt.gov/,https://covid19.mt.gov/
MT0009,549,30,MT,Montana,StayAtHome,1,1,1,1,20200326,20200328,20200411,20200426,,,,,,"In effect at 1201 am 20200328, initial expiry is through 20200410, so coded to 20200411.",https://covid19.mt.gov/Portals/223/Documents/Stay%20at%20Home%20Directive.pdf?ver=2020-03-26-173332-177,Montana0005,20200427,Updated DateExpiry to 20200411,https://news.mt.gov/,https://covid19.mt.gov/
MT0010,549,30,MT,Montana,Quarantine,1,1,1,1,20200330,20200330,20200411,,,,,,,"Any person coming to Montana must self-quarantine for 14 days irrespective of point of origin, anyone who has already arrived must self-quarantine for the remainder of the 14 day period. Effective through 20200410, so coded to 20200411",http://governor.mt.gov/Portals/16/Quarantine%20for%20Travelers.pdf?ver=2020-03-30-170637-190,Montana0006,20200427,Updated DateExpiry to 20200411,https://news.mt.gov/,https://covid19.mt.gov/
MT0015,549,30,MT,Montana,NEBusinessClose,1,1,1,1,20200407,20200407,20200424,,MT0008,,,,,"Extends NEBusinessClose through 20200424, but later in EO indicates it expires April 24, 2020 so coded to 20200424 for expiry",http://governor.mt.gov/Portals/16/Extension%20of%20Directives.pdf?ver=2020-04-07-172755-170,Montana0007,20200427,,https://news.mt.gov/,https://covid19.mt.gov/
MT0018,549,30,MT,Montana,Quarantine,1,1,1,1,20200407,20200407,20200424,,MT0010,,,,,"Extends travel quarantine mandate tthrough 20200424, but later in EO indicates it expires April 24, 2020 so coded to 20200424 for expiry",http://governor.mt.gov/Portals/16/Extension%20of%20Directives.pdf?ver=2020-04-07-172755-170,Montana0007,20200427,,https://news.mt.gov/,https://covid19.mt.gov/
MT0016,549,30,MT,Montana,RestaurantRestrict,1,1,1,1,20200407,20200407,20200424,,MT0013,,,,,"Extends restaurant restrictions through 20200424, but later in EO indicates it expires April 24, 2020 so coded to 20200424 for expiry",http://governor.mt.gov/Portals/16/Extension%20of%20Directives.pdf?ver=2020-04-07-172755-170,Montana0007,20200427,,https://news.mt.gov/,https://covid19.mt.gov/
MT0017,549,30,MT,Montana,SchoolClose,1,1,1,1,20200407,20200407,20200424,,MT0011,,,,,"Extends non-residential public school closure through 20200424, but later in EO indicates it expires April 24, 2020 so coded to 20200424 for expiry",http://governor.mt.gov/Portals/16/Extension%20of%20Directives.pdf?ver=2020-04-07-172755-170,Montana0007,20200427,,https://news.mt.gov/,https://covid19.mt.gov/
MT0014,549,30,MT,Montana,StayAtHome,1,1,1,1,20200407,20200407,20200424,,MT0009,,,,,"Extends StayAtHome through 20200424, but later in EO indicates it expires April 24, 2020 so coded to 20200424 for expiry",http://governor.mt.gov/Portals/16/Extension%20of%20Directives.pdf?ver=2020-04-07-172755-170,Montana0007,20200427,,https://news.mt.gov/,https://covid19.mt.gov/
MT0021,549,30,MT,Montana,NEBusinessClose,1,1,1,1,20200422,20200422,20200427,,MT0015,,,,,"Extends NEBusinessClose to 20200427, but is clear that the EO is easing it on 20200427 as well. Currently breaking into two entries for extending and easing",https://covid19.mt.gov/Portals/223/Documents/04-22-20%20Directive%20and%20Appx%20-%20Reopening%20Phase%20One.pdf?ver=2020-04-22-124954-977,Montana0008,20200427,,https://news.mt.gov/,https://covid19.mt.gov/
MT0030,549,30,MT,Montana,OtherBusinessClose,1,1,1,1,20200422,20200422,,,MT0036,,,,,"Extends closure of gyms, pools, hot tubs, places of assembly (eg, movie and performance theaters, concert halls, bowling alleys, bingo halls, and music halls)",https://covid19.mt.gov/Portals/223/Documents/04-22-20%20Directive%20and%20Appx%20-%20Reopening%20Phase%20One.pdf?ver=2020-04-22-124954-977,Montana0008,20200515,Updated Extends PID to MT0036,https://news.mt.gov/,https://covid19.mt.gov/
MT0025,549,30,MT,Montana,Quarantine,1,1,1,1,20200422,20200422,,,MT0018,,,,,Extended Quarantine through the end of the state of emergency (which does not have an explicit date at present),https://covid19.mt.gov/Portals/223/Documents/04-22-20%20Directive%20and%20Appx%20-%20Reopening%20Phase%20One.pdf?ver=2020-04-22-124954-977,Montana0008,20200427,,https://news.mt.gov/,https://covid19.mt.gov/
MT0023,549,30,MT,Montana,RestaurantRestrict,1,1,1,1,20200422,20200422,20200504,,MT0016,,,,,"Extends restaurant restrictions to 20200504, but it is clear the EO is easing it on 20200504 as well. Currently breaking into two entries for extending and easing",https://covid19.mt.gov/Portals/223/Documents/04-22-20%20Directive%20and%20Appx%20-%20Reopening%20Phase%20One.pdf?ver=2020-04-22-124954-977,Montana0008,20200427,,https://news.mt.gov/,https://covid19.mt.gov/
MT0031,549,30,MT,Montana,SchoolClose,1,1,1,1,20200422,20200422,20200507,,MT0017,,,,,"Extends closure of non-residential public schools through 20200506, so expiry is coded as 20200507",https://covid19.mt.gov/Portals/223/Documents/04-22-20%20Directive%20and%20Appx%20-%20Reopening%20Phase%20One.pdf?ver=2020-04-22-124954-977,Montana0008,20200427,,https://news.mt.gov/,https://covid19.mt.gov/
MT0019,549,30,MT,Montana,StayAtHome,1,1,1,1,20200422,20200422,20200426,,MT0014,,,,,"Extends StayAtHome order for individuals until 20200426, but is clear that EO is ending too on 20200426 (quote) lifting the Stay At Home directive (quote), so breaking into two entries for extension and ending",https://covid19.mt.gov/Portals/223/Documents/04-22-20%20Directive%20and%20Appx%20-%20Reopening%20Phase%20One.pdf?ver=2020-04-22-124954-977,Montana0008,20200427,,https://news.mt.gov/,https://covid19.mt.gov/
MT0020,549,30,MT,Montana,StayAtHome,1,1,1,1,20200422,20200426,,,,,,MT0019,,"Extends StayAtHome order for individuals until 20200426, but is clear that EO is ending too on 20200426 (quote) lifting the Stay At Home directive (quote), so breaking into two entries for extension and ending",https://covid19.mt.gov/Portals/223/Documents/04-22-20%20Directive%20and%20Appx%20-%20Reopening%20Phase%20One.pdf?ver=2020-04-22-124954-977,Montana0008,20200427,,https://news.mt.gov/,https://covid19.mt.gov/
MT0027,549,30,MT,Montana,StayAtHome,0,0,1,0,20200422,20200426,,,,,MT0019,,,"Recommends that all vulnerable individuals should continue to follow StayAtHome guidance, with vulnerable individuals being those over 65, with serious underlying health conditions (e.g., high blood pressure, chronic lung disease, obesity, asthma) or individuals whose immune systems are compromised",https://covid19.mt.gov/Portals/223/Documents/04-22-20%20Directive%20and%20Appx%20-%20Reopening%20Phase%20One.pdf?ver=2020-04-22-124954-977,Montana0008,20200427,,https://news.mt.gov/,https://covid19.mt.gov/
MT0028,549,30,MT,Montana,BusinessHealthSafety,1,1,1,1,20200422,20200427,,,,,,,,"Mandates for re-opening for Phase One per type of business, as detailed in EO's appendices. Broader mandates include reduced capacity and strict distancing. Business type specific mandates are detailed within the EO: ",https://covid19.mt.gov/Portals/223/Documents/04-22-20%20Directive%20and%20Appx%20-%20Reopening%20Phase%20One.pdf?ver=2020-04-22-124954-977,Montana0008,20200427,,https://news.mt.gov/,https://covid19.mt.gov/
MT0022,549,30,MT,Montana,NEBusinessClose,1,1,1,1,20200422,20200427,,,,,MT0021,,MT0028,"Extends NEBusinessClose to 20200427, but is clear that the EO is easing it on 20200427 as well. Currently breaking into two entries for extending and easing. For 20200427, included businesses eligible for re-opening are main street and retail businesses if they adhere to re-opening guidelines",https://covid19.mt.gov/Portals/223/Documents/04-22-20%20Directive%20and%20Appx%20-%20Reopening%20Phase%20One.pdf?ver=2020-04-22-124954-977,Montana0008,20200427,,https://news.mt.gov/,https://covid19.mt.gov/
MT0036,549,30,MT,Montana,OtherBusinessClose,1,1,1,1,20200422,20200427,,,MT0021,,,,,Continues closure for other businesses not yet allowed to resume in-person services,"https://covid19.mt.gov/Portals/223/Documents/04-22-20%20Directive%20and%20Appx%20-%20Reopening%20Phase%20One.pdf?ver=2020-04-22-124954-977	Montana0008	20200427",Montana0008,20200515,,"https://news.mt.gov/	https://covid19.mt.gov/",
MT0029,549,30,MT,Montana,OtherBusinessClose,1,1,1,1,20200422,20200504,,,,,MT0036,,MT0028,"Easing restrictions for casinos to open, conditional on following Phase One general and specific guidelines under the EO",https://covid19.mt.gov/Portals/223/Documents/04-22-20%20Directive%20and%20Appx%20-%20Reopening%20Phase%20One.pdf?ver=2020-04-22-124954-977,Montana0008,20200515,Updated Eases PID to MT0036,https://news.mt.gov/,https://covid19.mt.gov/
MT0024,549,30,MT,Montana,RestaurantRestrict,1,1,1,1,20200422,20200504,,,,,MT0023,,MT0028,"Extends restaurant restrictions to 20200504, but it is clear the EO is easing it on 20200504 as well. Currently breaking into two entries for extending and easing. Must follow strict physical distanccing and reduced capacity protocols, as well as closing operations strictly by 1130 pm and expansions for delivery as possible",https://covid19.mt.gov/Portals/223/Documents/04-22-20%20Directive%20and%20Appx%20-%20Reopening%20Phase%20One.pdf?ver=2020-04-22-124954-977,Montana0008,20200427,,https://news.mt.gov/,https://covid19.mt.gov/
MT0032,549,30,MT,Montana,SchoolClose,0,1,1,1,20200422,20200507,,,,,MT0031,,MT0033,"Eases restriction on in-person instruction starting on 20200507. All schools have the option to return to in-classroom teaching delivery, per discretion of local schoolboards. Re-opening will require clear re-opening guidelines and adherance ",https://covid19.mt.gov/Portals/223/Documents/04-22-20%20Directive%20and%20Appx%20-%20Reopening%20Phase%20One.pdf?ver=2020-04-22-124954-977,Montana0008,20200427,,https://news.mt.gov/,https://covid19.mt.gov/
MT0033,549,30,MT,Montana,SchoolHealthSafety,1,1,1,1,20200422,20200507,,,,,,,,Requirements for school re-opening are detailed per EO (Appendix A),https://covid19.mt.gov/Portals/223/Documents/04-22-20%20Directive%20and%20Appx%20-%20Reopening%20Phase%20One.pdf?ver=2020-04-22-124954-977,Montana0008,20200427,,https://news.mt.gov/,https://covid19.mt.gov/
MT0034,549,30,MT,Montana,BusinessHealthSafety,1,1,1,1,20200508,20200515,,,,,,,,"Mandates for re-opening for Phase One for Gyms and fitness studios, Pools at gyms, Theaters, including movie theaters, Museums, as detailed in EO's appendices. Broader mandates include reduced capacity and strict distancing. ",https://covid19.mt.gov/Portals/223/Documents/Phase%20One%20Expansion%20Plus%20Guidance.pdf?ver=2020-05-08-150423-113,Montana0009,20200515,,https://news.mt.gov/,https://covid19.mt.gov/
MT0035,549,30,MT,Montana,OtherBusinessClose,1,1,1,1,20200508,20200515,,,,,MT0030,,MT0034,"Effective May 15, 2020, the following businesses can become operational during Phase I under strict physical distancing and reduced capacity protocols in accordance with the Phase One Directive and the Guidance attached to this Directive: Gyms and fitness studios, Pools at gyms, Theaters, including movie theaters, Museums",https://covid19.mt.gov/Portals/223/Documents/Phase%20One%20Expansion%20Plus%20Guidance.pdf?ver=2020-05-08-150423-113,Montana0009,20200515,,https://news.mt.gov/,https://covid19.mt.gov/
MT0037,549,30,MT,Montana,OtherBusinessClose,1,1,1,1,20200508,20200515,,,MT0030,,,,,"Other places of assembly such as performance theaters, concert halls, bowling alleys, bingo halls, music halls, and pools that are not in gyms or at a licensed public accommodation shall remain closed.",https://covid19.mt.gov/Portals/223/Documents/Phase%20One%20Expansion%20Plus%20Guidance.pdf?ver=2020-05-08-150423-113,Montana0009,20200516,,https://news.mt.gov/,https://covid19.mt.gov/
NE0001,550,31,NE,Nebraska,EmergDec,1,1,1,1,20200313,20200313,,,,,,,,State of Emergency declaration. Does not appear to include formal expiry.,https://www.dropbox.com/s/64xel8oha2gw22h/2020%20State%20of%20Emergency%20-%20Coronavirus%20.pdf?dl=0,Nebraska0001,20200504,,https://govdocs.nebraska.gov/docs/pilot/pubs/eoindex.html,http://dhhs.ne.gov/Pages/Coronavirus.aspx
NE0002,550,31,NE,Nebraska,GathRecomAny,0,1,1,1,20200316,20200316,,,,,,,,"Strongly recommends limiting all gatherings, especially those gatherings of more than 50 people. Not a formal restriction.",https://www.dropbox.com/s/sk95elfp6bnefsv/DHM%203.19.2020.pdf?dl=0,Nebraska0002,20200504,Updated StatePolicy to GathRecomAny,https://govdocs.nebraska.gov/docs/pilot/pubs/eoindex.html,http://dhhs.ne.gov/Pages/Coronavirus.aspx
NE0004,550,31,NE,Nebraska,GathRestrict10,1,0,0,1,20200319,20200319,20200430,,,,,,,"In effect for Cass, Douglas, Sarpy and Washington counties. Mandate from Department of Public Health. Expiry is 20200430",https://www.dropbox.com/s/sk95elfp6bnefsv/DHM%203.19.2020.pdf?dl=0,"Nebraska0003, Nebraska0004",20200504,"Added expiry date, coded 0 to reflect not statewide ",https://govdocs.nebraska.gov/docs/pilot/pubs/eoindex.html,http://dhhs.ne.gov/Pages/Coronavirus.aspx
NE0003,550,31,NE,Nebraska,GathRestrictAny,1,0,0,1,20200319,20200319,20200430,,,,,,,"In effect for Cass, Douglas, Sarpy and Washington counties. Mandate from Department of Public Health. Expiry is 20200430",https://www.dropbox.com/s/sk95elfp6bnefsv/DHM%203.19.2020.pdf?dl=0,"Nebraska0003, Nebraska0004",20200509,,https://govdocs.nebraska.gov/docs/pilot/pubs/eoindex.html,http://dhhs.ne.gov/Pages/Coronavirus.aspx
NE0005,550,31,NE,Nebraska,RestaurantRestrict,1,0,0,1,20200319,20200319,20200430,,,,,,,"Limited operations required (carry-out, delivery, drive-thru only): restaurants, bars. Permits restaurants to remain in operation if they serve no more than 10 patrons at a time. In effect for Cass, Douglas, Sarpy and Washington counties, Mandate from Department of Public Health. Expiry is 20200430",https://www.dropbox.com/s/sk95elfp6bnefsv/DHM%203.19.2020.pdf?dl=0,"Nebraska0003, Nebraska0004",20200504,"Added expiry date, coded 0 to reflect not statewide ",https://govdocs.nebraska.gov/docs/pilot/pubs/eoindex.html,http://dhhs.ne.gov/Pages/Coronavirus.aspx
NE0006,550,31,NE,Nebraska,SchoolClose,1,0,0,1,20200319,20200319,20200430,,,,,,,"Schools are closed to in-person instruction in Cass, Douglas, Sarpy and Washington counties until at least 20200430.",https://www.dropbox.com/s/sk95elfp6bnefsv/DHM%203.19.2020.pdf?dl=0,"Nebraska0003, Nebraska0004",20200509,,https://govdocs.nebraska.gov/docs/pilot/pubs/eoindex.html,http://dhhs.ne.gov/Pages/Coronavirus.aspx
NE0011,550,31,NE,Nebraska,CaseIsolation,1,0,0,1,20200325,20200325,20200430,,,,,,,"Individuals who test positive for COVID-19 or have symptoms of COVID-19 (presumptive case) and individuals who reside with indiviudals who have tested positive for COVID-19 or are presumptive cases shall home-quarantine for a period of no less than 14 days. Applicable to Cass, Douglass, Sarpy counties until April 30, and Lancaster, Dodge, Saunders, and Washington counties until May 6. Currently using the earliest date of expiry for this record",https://www.douglascountyhealth.com/images/COVID-19/DHM_3.25.2020.pdf,Nebraska0006,20200509,,,
NE0008,550,31,NE,Nebraska,GathRestrict10,1,0,0,1,20200325,20200325,20200506,,,NE0004,,,,"Expands PID NE0004 to include Lancaster, Dodge, and Saunders counties, adding Washington county to the 20200506 expiry. Original expiry for Cass, Douglas, and Sarpy of 20200430 remains, so keeping as an expansion only",https://www.dropbox.com/s/ade9iruczk87wxk/DHM%203.25.2020.pdf?dl=0,"Nebraska0005, Nebraska0007",20200509,,,
NE0007,550,31,NE,Nebraska,GathRestrictAny,1,0,0,1,20200325,20200325,20200506,,,NE0003,,,,"Expands PID NE0003 to include Lancaster, Dodge, and Saunders counties, adding Washington county to the 20200506 expiry. Original expiry for Cass, Douglas, and Sarpy of 20200430 remains, so keeping as an expansion only",https://www.dropbox.com/s/ade9iruczk87wxk/DHM%203.25.2020.pdf?dl=0,"Nebraska0005, Nebraska0007",20200509,,,
NE0009,550,31,NE,Nebraska,RestaurantRestrict,1,0,0,1,20200325,20200325,20200506,,,NE0005,,,,"Expands PID NE0005 to include Lancaster, Dodge, and Saunders counties, adding Washington county to the 20200506 expiry. Original expiry for Cass, Douglas, and Sarpy of 20200430 remains, so keeping as an expansion only",https://www.dropbox.com/s/ade9iruczk87wxk/DHM%203.25.2020.pdf?dl=0,"Nebraska0005, Nebraska0007",20200509,,,
NE0010,550,31,NE,Nebraska,SchoolClose,1,0,0,1,20200325,20200325,20200506,,,NE0006,,,,"Expands PID NE0006 to include Lancaster, Dodge, and Saunders counties, adding Washington county to the 20200506 expiry. Original expiry for Cass, Douglas, and Sarpy of 20200430 remains, so keeping as an expansion only",https://www.dropbox.com/s/ade9iruczk87wxk/DHM%203.25.2020.pdf?dl=0,"Nebraska0005, Nebraska0007",20200509,,,
NE0016,550,31,NE,Nebraska,CaseIsolation,1,0,0,1,20200328,20200328,20200506,,,NE0011,,,,"Expands PID NE0011 to include Butler, Hall, Hamilton, Merrick, Polk, Seward, and York counties. Cass, Douglas, and Sarpy counties are technically still under an expiry of 20200430, while all others are for 20200506",https://www.dropbox.com/s/qaasj30cvqp9mun/DHM%203.28.2020.pdf?dl=0,"Nebraska0008, Nebraska0009",20200509,,,
NE0013,550,31,NE,Nebraska,GathRestrict10,1,0,0,1,20200328,20200328,20200506,,,NE0008,,,,"Expands PID NE0008 to include Butler, Hall, Hamilton, Merrick, Polk, Seward, and York counties. Cass, Douglas, and Sarpy counties are technically still under an expiry of 20200430, while all others are for 20200506",https://www.dropbox.com/s/qaasj30cvqp9mun/DHM%203.28.2020.pdf?dl=0,"Nebraska0008, Nebraska0009",20200509,,,
NE0012,550,31,NE,Nebraska,GathRestrictAny,1,0,0,1,20200328,20200328,20200506,,,NE0007,,,,"Expands PID NE0007 to include Butler, Hall, Hamilton, Merrick, Polk, Seward, and York counties. Cass, Douglas, and Sarpy counties are technically still under an expiry of 20200430, while all others are for 20200506",https://www.dropbox.com/s/qaasj30cvqp9mun/DHM%203.28.2020.pdf?dl=0,Nebraska0007,20200509,,,
NE0014,550,31,NE,Nebraska,RestaurantRestrict,1,0,0,1,20200328,20200328,20200506,,,NE0009,,,,"Expands PID NE0009 to include Butler, Hall, Hamilton, Merrick, Polk, Seward, and York counties. Cass, Douglas, and Sarpy counties are technically still under an expiry of 20200430, while all others are for 20200506",https://www.dropbox.com/s/qaasj30cvqp9mun/DHM%203.28.2020.pdf?dl=0,"Nebraska0008, Nebraska0009",20200509,,,
NE0015,550,31,NE,Nebraska,SchoolClose,1,0,0,1,20200328,20200328,20200506,,,NE0010,,,,"Expands PID NE0010 to include Butler, Hall, Hamilton, Merrick, Polk, Seward, and York counties. Cass, Douglas, and Sarpy counties are technically still under an expiry of 20200430, while all others are for 20200506",https://www.dropbox.com/s/qaasj30cvqp9mun/DHM%203.28.2020.pdf?dl=0,"Nebraska0008, Nebraska0009",20200509,,,
NE0021,550,31,NE,Nebraska,CaseIsolation,1,0,0,1,20200329,20200329,20200506,,,NE0016,,,,"Expands PID NE0016 to include Burt, Cuming, Madison, and Stanton counties.  Cass, Douglas, and Sarpy counties are technically still under an expiry of 20200430, while all others are for 20200506",https://www.dropbox.com/s/ryyx9aas2sxgcjq/DHM%203.29.2020.pdf?dl=0,"Nebraska0010, Nebraska0010",20200509,,,
NE0018,550,31,NE,Nebraska,GathRestrict10,1,0,0,1,20200329,20200329,20200506,,,NE0013,,,,"Expands PID NE0013 to include Burt, Cuming, Madison, and Stanton counties.  Cass, Douglas, and Sarpy counties are technically still under an expiry of 20200430, while all others are for 20200506",https://www.dropbox.com/s/ryyx9aas2sxgcjq/DHM%203.29.2020.pdf?dl=0,"Nebraska0010, Nebraska0010",20200509,,,
NE0017,550,31,NE,Nebraska,GathRestrictAny,1,0,0,1,20200329,20200329,20200506,,,NE0012,,,,"Expands PID NE0012 to include Burt, Cuming, Madison, and Stanton counties.  Cass, Douglas, and Sarpy counties are technically still under an expiry of 20200430, while all others are for 20200506",https://www.dropbox.com/s/ryyx9aas2sxgcjq/DHM%203.29.2020.pdf?dl=0,"Nebraska0010, Nebraska0010",20200509,,,
NE0019,550,31,NE,Nebraska,RestaurantRestrict,1,0,0,1,20200329,20200329,20200506,,,NE0014,,,,"Expands PID NE0014 to include Burt, Cuming, Madison, and Stanton counties.  Cass, Douglas, and Sarpy counties are technically still under an expiry of 20200430, while all others are for 20200506",https://www.dropbox.com/s/ryyx9aas2sxgcjq/DHM%203.29.2020.pdf?dl=0,"Nebraska0010, Nebraska0010",20200509,,,
