PID,location_id,StateFIPS,StatePostal,StateName,StatePolicy,Mandate,StateWide,SWGeo,SWPop,DateIssued,DateEnacted,DateExpiry,DateEnded,Extends,Expands,Eases,Ends,Depends,PolicyCodingNotes,PolicySource,PolicySourceID,LastUpdated,LastUpdatedNotes,UpdatingSource1,UpdatingSource2
OK0021,559,40,OK,Oklahoma,OtherBusinessClose,1,1,1,1,20200424,20200501,20200524,,,,OK0018,,OK0029,"Entertainment, movie theaters, sporting venues, gyms, and places of worship can reopen conditional on adhering to sanitation and CDC distancing protocols. Tattoo parlors can reopen to appointment only conditional on adhering to sanitation and CDC distancing protocols. Bars remain closed.",https://www.okcommerce.gov/wp-content/uploads/Open-Up-and-Recover-Safely-Plan.pdf,"Oklahoma0014, Oklahoma0015",20200425,,https://www.sos.ok.gov/gov/execorders.aspx,
OK0022,559,40,OK,Oklahoma,RestaurantRestrict,1,1,1,1,20200424,20200501,20200524,,,,OK0017,,OK0023,Dining restablishments can reopen for in-person services conditional on adhering to sanitation and CDC distancing protocols.,https://www.okcommerce.gov/wp-content/uploads/Open-Up-and-Recover-Safely-Plan.pdf,"Oklahoma0014, Oklahoma0015",20200425,,https://www.sos.ok.gov/gov/execorders.aspx,
OK0028,559,40,OK,Oklahoma,GathRestrictAny,1,1,1,1,20200424,20200515,20200524,,,,OK0025,,,Funerals and weddings may resume under social distancing protocols,https://www.okcommerce.gov/wp-content/uploads/Open-Up-and-Recover-Safely-Plan.pdf,"Oklahoma0014, Oklahoma0015",20200425,,https://www.sos.ok.gov/gov/execorders.aspx,
OK0027,559,40,OK,Oklahoma,OtherBusinessClose,1,1,1,1,20200424,20200515,20200524,,,,OK0018,,,"Organized sports activities, bars can reopen under proper social distancing and sanitation protocols. ",https://www.okcommerce.gov/wp-content/uploads/Open-Up-and-Recover-Safely-Plan.pdf,"Oklahoma0014, Oklahoma0015",20200425,,https://www.sos.ok.gov/gov/execorders.aspx,
OR0001,560,41,OR,Oregon,EmergDec,1,1,1,1,20200308,20200308,20200508,,,,,,,"State of emergency proclamation. In effect for 60 days, through 20200507, so coded to 20200508 (information on expiry was in the extension of the emergency declaraiton, PolicySourceID Oregon0011)",https://www.oregon.gov/gov/Documents/executive_orders/eo_20-03.pdf,Oregon0001,20200324,,https://www.oregon.gov/gov/admin/pages/executive-orders.aspx,https://govstatus.egov.com/OR-OHA-COVID-19
OR0002,560,41,OR,Oregon,GathRestrict250,1,1,1,1,20200312,20200312,20200408,,,,,,,"Issued a 250+ person prohibition. In effect immediately on 20200312, with initial expiry date of 20200408. ",https://www.oregon.gov/gov/Documents/executive_orders/eo_20-05.pdf,Oregon0002,20200516,Updated DateExpiry to 20200408,https://www.oregon.gov/gov/admin/pages/executive-orders.aspx,https://govstatus.egov.com/OR-OHA-COVID-19
OR0003,560,41,OR,Oregon,GathRestrictAny,1,1,1,1,20200312,20200312,20200408,,,,,,,"Issued a 250+ person prohibition. In effect immediately on 20200312, with initial expiry date of 20200408",https://www.oregon.gov/gov/Documents/executive_orders/eo_20-05.pdf,Oregon0002,20200516,Updated DateExpiry to 20200408,https://www.oregon.gov/gov/admin/pages/executive-orders.aspx,https://govstatus.egov.com/OR-OHA-COVID-19
OR0004,560,41,OR,Oregon,SchoolClose,1,1,1,1,20200312,20200316,20200401,,,,,,,"Closes all public schools in Oregon from 20200316 through 20200331, so coded to 20200401",https://www.oregon.gov/newsroom/Pages/NewsDetail.aspx?newsid=36164,Oregon0006,20200516,Updated DateExpiry to 20200401,https://www.oregon.gov/gov/admin/pages/executive-orders.aspx,https://govstatus.egov.com/OR-OHA-COVID-19
OR0005,560,41,OR,Oregon,GathRestrict25,1,1,1,1,20200317,20200317,20200415,,OR0002,OR0002,,,,"Prohibition of gatherings of 25 or more, inclusive of spiritual gatherings. In effect as of 5 pm on 20200317, with an initial expiry through 20200414, so coded to 20200415",https://www.oregon.gov/gov/Documents/executive_orders/eo_20-07.pdf,Oregon0004,20200516,Updated DateExpiry to 20200415,https://www.oregon.gov/gov/admin/pages/executive-orders.aspx,https://govstatus.egov.com/OR-OHA-COVID-19
OR0010,560,41,OR,Oregon,GathRestrictAny,1,1,1,1,20200317,20200317,20200415,,OR0003,OR0003,,,,Extended gathering restriction,https://www.oregon.gov/gov/Documents/executive_orders/eo_20-07.pdf,Oregon0004,20200516,,https://www.oregon.gov/gov/admin/pages/executive-orders.aspx,https://govstatus.egov.com/OR-OHA-COVID-19
OR0006,560,41,OR,Oregon,RestaurantRestrict,1,1,1,1,20200317,20200317,20200415,,,,,,,"Limited operations required (off-premises consumption only): restaurants, bars. In effect as of 5 pm on 20200317, with an initial expiry through 20200414, so coded to 20200415",https://www.oregon.gov/gov/Documents/executive_orders/eo_20-07.pdf,Oregon0004,20200516,Updated DateExpiry to 20200415,https://www.oregon.gov/gov/admin/pages/executive-orders.aspx,https://govstatus.egov.com/OR-OHA-COVID-19
OR0007,560,41,OR,Oregon,SchoolClose,1,1,1,1,20200317,20200317,20200429,,OR0004,,,,,"Extends public school closures through 20200428, so coded to 20200429. Tribal and private schools are not subject to the order",https://www.oregon.gov/gov/Documents/executive_orders/eo_20-08.pdf,Oregon0003,20200516,,https://www.oregon.gov/gov/admin/pages/executive-orders.aspx,https://govstatus.egov.com/OR-OHA-COVID-19
OR0011,560,41,OR,Oregon,SchoolClose,1,1,1,1,20200319,20200321,20200429,,,,,,,"Closes colleges and universities through 20200428, so coded to 20200429. EOs are treating these separately from K-12 institutions, so coding tem separately as well",https://www.oregon.gov/gov/Documents/executive_orders/eo_20-09.pdf,Oregon0005,20200516,,https://www.oregon.gov/gov/admin/pages/executive-orders.aspx,https://govstatus.egov.com/OR-OHA-COVID-19
OR0014,560,41,OR,Oregon,GathRestrict5,1,1,1,1,20200323,20200323,,,OR0005,OR0005,,,,"Non-essential social and recreational gatherings of individuals outside of a house are prohibited immediately, regardless of size. Expands gathering restriction  previously of maximum 25, coding as GathRestrict5 as that is our smallest quantity",https://www.oregon.gov/gov/Documents/executive_orders/eo_20-12.pdf,Oregon0007,20200516,"FLAG: not sure if this is correct, but the EOs don't appear to extend this...",https://www.oregon.gov/gov/admin/pages/executive-orders.aspx,https://govstatus.egov.com/OR-OHA-COVID-19
OR0013,560,41,OR,Oregon,GathRestrictAny,1,1,1,1,20200323,20200323,,,OR0010,,,,,Extends gathering restrictions,https://www.oregon.gov/gov/Documents/executive_orders/eo_20-12.pdf,Oregon0007,20200516,,https://www.oregon.gov/gov/admin/pages/executive-orders.aspx,https://govstatus.egov.com/OR-OHA-COVID-19
OR0009,560,41,OR,Oregon,StayAtHome,1,1,1,1,20200323,20200323,,,,,,,,"Formal stay-at-home order, violation will result in penalty. In effect immediately on 20200323, no formal expiry provided",https://www.oregon.gov/gov/Documents/executive_orders/eo_20-12.pdf,Oregon0007,20200324,,https://www.oregon.gov/gov/admin/pages/executive-orders.aspx,https://govstatus.egov.com/OR-OHA-COVID-19
OR0008,560,41,OR,Oregon,OtherBusinessClose,1,1,1,1,20200323,20200324,,,,,,,,"Requires closure of the following businesses: amusementparks, art galleries, barber shops and hair salons, bowling alleys, indoor and outdoor malls, jewelry shops, spas and massage therapy services, museums, nail salons, tanning salsons, ski resorts, social clubs, theaters, etc. Also closes private and public campgrounds, pools, skate parks, outdoor sports courts, and playgrounds,",https://www.oregon.gov/gov/Documents/executive_orders/eo_20-12.pdf,Oregon0007,20200330,On 20200330 - recoding to OtherBuisnessClose from its original coding as NEBusinessClose.,https://www.oregon.gov/gov/admin/pages/executive-orders.aspx,https://govstatus.egov.com/OR-OHA-COVID-19
OR0012,560,41,OR,Oregon,RestaurantRestrict,1,1,1,1,20200407,20200407,,,OR0006,,,,,Extends restaurant restrictions without any formal expiry,https://www.oregon.gov/gov/Documents/executive_orders/eo_20-14.pdf,Oregon0008,20200516,,https://www.oregon.gov/gov/admin/pages/executive-orders.aspx,https://govstatus.egov.com/OR-OHA-COVID-19
OR0015,560,41,OR,Oregon,SchoolClose,1,1,1,1,20200417,20200417,20200614,,OR0011,,,,,"Extends closure of in-person instruction at higher education institutions through 20200613, so coded to 20200614",https://www.oregon.gov/gov/Documents/executive_orders/eo_20-17.pdf,Oregon0009,20200516,,https://www.oregon.gov/gov/admin/pages/executive-orders.aspx,https://govstatus.egov.com/OR-OHA-COVID-19
OR0016,560,41,OR,Oregon,SchoolClose,1,1,1,1,20200423,20200428,20200701,,OR0007,OR0007,,,,"Extends closure of K-12 schools for in-person instruction, and explicitly expands to private schools as well",https://www.oregon.gov/gov/Documents/executive_orders/eo_20-20.pdf,Oregon0010,20200516,,https://www.oregon.gov/gov/admin/pages/executive-orders.aspx,https://govstatus.egov.com/OR-OHA-COVID-19
OR0017,560,41,OR,Oregon,EmergDec,1,1,1,1,20200501,20200508,20200707,,OR0001,,,,,"Extends state of emergency for additional 60 days, through July 6, 2020, so coded to 20200707",https://www.oregon.gov/gov/Documents/executive_orders/eo_20-24.pdf,Oregon0011,20200516,,https://www.oregon.gov/gov/admin/pages/executive-orders.aspx,https://govstatus.egov.com/OR-OHA-COVID-19
OR0023,560,41,OR,Oregon,OtherBusinessClose,1,1,1,1,20200514,20200514,,,,,OR0008,,,"Statewide easing of restrictions on the following businesses, conditional on them following health and safety guidelines: ski resorts",https://www.oregon.gov/gov/Documents/executive_orders/eo_20-25.pdf,Oregon0012,20200516,,https://www.oregon.gov/gov/admin/pages/executive-orders.aspx,https://govstatus.egov.com/OR-OHA-COVID-19
OR0024,560,41,OR,Oregon,OtherBusinessClose,1,1,1,1,20200514,20200514,,,OR0008,,,,,Continues statewide restrictions of businesses under EO 20-12 except for ski resorts,https://www.oregon.gov/gov/Documents/executive_orders/eo_20-25.pdf,Oregon0012,20200516,,https://www.oregon.gov/gov/admin/pages/executive-orders.aspx,https://govstatus.egov.com/OR-OHA-COVID-19
OR0029,560,41,OR,Oregon,GathRestrict10,1,0,0,1,20200514,20200515,,,,,OR0014,,,"For baseline counties (Multnomah, Washington, Clackamas, Marion, Polk), social gatherings of more than 10 people remain prohibited. Eases prohibition on all social gatherings, of any number",https://www.oregon.gov/gov/Documents/executive_orders/eo_20-25.pdf,Oregon0012,20200516,,https://www.oregon.gov/gov/admin/pages/executive-orders.aspx,https://govstatus.egov.com/OR-OHA-COVID-19
OR0031,560,41,OR,Oregon,GathRestrict25,1,1,1,1,20200514,20200515,,,,,OR0014,,,"For Phase One counties (all counties but Multnomah, Washington, Clackamas, Marion, Polk), all gatherings more than 25 are prohibited. For baseline counties, this gathering restriction applies for cultural, civic, and faith gatherings (otherwise a restriction of 10 for social gatherings)",https://www.oregon.gov/gov/Documents/executive_orders/eo_20-25.pdf,Oregon0012,20200516,,https://www.oregon.gov/gov/admin/pages/executive-orders.aspx,https://govstatus.egov.com/OR-OHA-COVID-19
OR0020,560,41,OR,Oregon,GathRestrictAny,1,1,1,1,20200514,20200515,,,OR0013,,,,,Any restriction on gatherings continues statewide,https://www.oregon.gov/gov/Documents/executive_orders/eo_20-25.pdf,Oregon0012,20200516,,https://www.oregon.gov/gov/admin/pages/executive-orders.aspx,https://govstatus.egov.com/OR-OHA-COVID-19
OR0025,560,41,OR,Oregon,OtherBusinessClose,1,1,1,1,20200514,20200515,,,,,OR0024,,,"Statewide easing of restrictions on the following businesses, conditional on them following health and safety guidelines: art galleries, boutiques, furniture stores, jewelry shops, retail businesses that do not otherwise fall under the businesses listed under EO 20-12 (eg, bowling alleys, places of indoor amusement)",https://www.oregon.gov/gov/Documents/executive_orders/eo_20-25.pdf,Oregon0012,20200516,,https://www.oregon.gov/gov/admin/pages/executive-orders.aspx,https://govstatus.egov.com/OR-OHA-COVID-19
OR0026,560,41,OR,Oregon,OtherBusinessClose,1,1,1,1,20200514,20200515,,,OR0024,,,,,"Statewide closure of the following businesses continue: pools, skate parks, outdoor sports courts, playgrounds, amusement parks, art galleries, social clubs, theaters, etc. ",https://www.oregon.gov/gov/Documents/executive_orders/eo_20-25.pdf,Oregon0012,20200516,,https://www.oregon.gov/gov/admin/pages/executive-orders.aspx,https://govstatus.egov.com/OR-OHA-COVID-19
OR0027,560,41,OR,Oregon,OtherBusinessClose,1,0,0,1,20200514,20200515,,,,,OR0024,,,"For Phase One counties (all counties but Multnomah, Washington, Clackamas, Marion, Polk), the following businesses can have in-person services conditional on following health and safety protocols: personal care businesses and facilities (salons, gyms), all retail businesses, including malls and shopping centers",https://www.oregon.gov/gov/Documents/executive_orders/eo_20-25.pdf,Oregon0012,20200516,,https://www.oregon.gov/gov/admin/pages/executive-orders.aspx,https://govstatus.egov.com/OR-OHA-COVID-19
OR0028,560,41,OR,Oregon,OtherBusinessClose,1,0,0,1,20200514,20200515,,,OR0024,,,,,"Continues business restrictions in baseline counties (Multnomah, Washington, Clackamas, Marion, Polk): personal care businesses and facilities (salons, gyms), all retail businesses, including malls and shopping centers",https://www.oregon.gov/gov/Documents/executive_orders/eo_20-25.pdf,Oregon0012,20200516,,https://www.oregon.gov/gov/admin/pages/executive-orders.aspx,https://govstatus.egov.com/OR-OHA-COVID-19
OR0021,560,41,OR,Oregon,RestaurantRestrict,1,0,0,1,20200514,20200515,,,,,OR0012,,,"Restaurant restrictions eased for 28 counties approved for Phase One (all counties but Multnomah, Washington, Clackamas, Marion, Polk), conditional on meeting health and safety guidelines: dine in services until 10 pm only ",https://www.oregon.gov/gov/Documents/executive_orders/eo_20-25.pdf,Oregon0012,20200516,,https://www.oregon.gov/gov/admin/pages/executive-orders.aspx,https://govstatus.egov.com/OR-OHA-COVID-19
OR0022,560,41,OR,Oregon,RestaurantRestrict,1,0,0,1,20200514,20200515,,,OR0012,,,,,"Restaurant restrictions remain for counties that remain at baseline: Multnomah, Washington, Clackamas, Marion, Polk. https://govstatus.egov.com/reopening-oregon#phasePlanBlocks",https://www.oregon.gov/gov/Documents/executive_orders/eo_20-25.pdf,Oregon0012,20200516,,https://www.oregon.gov/gov/admin/pages/executive-orders.aspx,https://govstatus.egov.com/OR-OHA-COVID-19
OR0018,560,41,OR,Oregon,StayAtHome,1,0,0,1,20200514,20200515,,,,,OR0009,,,"Stay-at-home order eased/ended for 28 counties approved to Phase One (all counties but Multnomah, Washington, Clackamas, Marion, Polk)",https://www.oregon.gov/gov/Documents/executive_orders/eo_20-25.pdf,Oregon0012,20200516,FLAG: unsure if it should be eased or ended,https://www.oregon.gov/gov/admin/pages/executive-orders.aspx,https://govstatus.egov.com/OR-OHA-COVID-19
OR0019,560,41,OR,Oregon,StayAtHome,1,0,0,1,20200514,20200515,,,OR0009,,,,,"Stay-at-home order continues for counties that remain at baseline: Multnomah, Washington, Clackamas, Marion, Polk. https://govstatus.egov.com/reopening-oregon#phasePlanBlocks",https://www.oregon.gov/gov/Documents/executive_orders/eo_20-25.pdf,Oregon0012,20200516,,https://www.oregon.gov/gov/admin/pages/executive-orders.aspx,https://govstatus.egov.com/OR-OHA-COVID-19
PA0001,561,42,PA,Pennsylvania,EmergDec,1,1,1,1,20200306,20200306,,,,,,,,Disaster Emergency declared. No expiry provided,https://www.governor.pa.gov/wp-content/uploads/2020/03/20200306-COVID19-Digital-Proclamation.pdf,Pennsylvania0001,20200324,,https://www.governor.pa.gov/newsroom/,https://www.pa.gov/guides/responding-to-covid-19/
PA0017,561,42,PA,Pennsylvania,GathRecomAny,0,1,1,1,20200313,20200313,,,,,,,,"(quote) Wolf Administration strongly encourages the suspension of large gatherings, events, conferences of 250 individuals or more (quote)",https://www.governor.pa.gov/newsroom/gov-wolf-sec-of-health-pa-chamber-outline-covid-19-mitigation-guidance-for-pennsylvania-schools-businesses-and-additional-closures-in-delaware-county/,Pennsylvania0003,20200509,,https://www.governor.pa.gov/newsroom/,https://www.pa.gov/guides/responding-to-covid-19/
PA0002,561,42,PA,Pennsylvania,SchoolClose,1,1,1,1,20200313,20200316,20200330,,,,,,,All K-12 schools to close for 10 business days effective 20200316. Expiry would then be 20200330,https://www.governor.pa.gov/newsroom/governor-wolf-announces-closure-of-pennsylvania-schools/,Pennsylvania0002,20200509,Added DateExpiry of 20200330,https://www.governor.pa.gov/newsroom/,https://www.pa.gov/guides/responding-to-covid-19/
PA0003,561,42,PA,Pennsylvania,RestaurantRestrict,1,0,0,1,20200315,20200316,20200330,,,,,,,"Limited operations required (to carry out, delivery, drive-through) only in restaurants and bars in Alleghany, Bucks, Chester, Delaware, and Montgomery counties. In effect at 1201 am on 20200316 and for 14 days, so expiry coded to 20200330",https://www.governor.pa.gov/newsroom/wolf-administration-orders-restaurants-and-bars-to-close-dine-in-service-in-mitigation-counties-to-stop-spread-of-covid-19/,Pennsylvania0004,20200509,Added DateExpiry of 20200330,https://www.governor.pa.gov/newsroom/,https://www.pa.gov/guides/responding-to-covid-19/
PA0004,561,42,PA,Pennsylvania,GathRecomAny,0,1,1,1,20200316,20200317,,,,PA0017,,,,"(quote) strongly encourages the suspension of large gatherings, events, and gatherings of more than 10 people (quote). Expands PA0017 since the recommendation is now for 10 people versus 250",https://www.governor.pa.gov/newsroom/gov-wolf-puts-statewide-covid-19-mitigation-efforts-in-effect-stresses-need-for-every-pennsylvanian-to-take-action-to-stop-the-spread/,Pennsylvania0005,20200413,,https://www.governor.pa.gov/newsroom/,https://www.pa.gov/guides/responding-to-covid-19/
PA0005,561,42,PA,Pennsylvania,OtherBusinessClose,0,1,1,1,20200316,20200317,,,,,,,,"(quote) we strongly urge non-essential businesses across the commonwealth to do their part by temporarily closing (quote). Refers to the following businesses: entertainment, hospitality, and recreation facilities (eg, gyms), hair salons and barber shops, nail salons, casinos, concert venues, theaters, sproting event venues and golf courses, and retail facilities.",https://www.governor.pa.gov/newsroom/wolf-administration-updates-businesses-on-guidance-for-covid-19-mitigation-efforts/,Pennsylvania0006,20200415,"Updated to Mandate as 0, and linking to correct issuance strongly urging particular businesses to close ",https://www.governor.pa.gov/newsroom/,https://www.pa.gov/guides/responding-to-covid-19/
PA0006,561,42,PA,Pennsylvania,RestaurantRestrict,1,1,1,1,20200316,20200317,20200331,,,PA0003,,,,"Limited operations required (carry-out, delivery, drive-though only): restaurants. Expanded to all counties, in effect at 1201 am on 20200317 for 14 days. Expiry is coded to 20200331",https://www.governor.pa.gov/newsroom/wolf-administration-updates-businesses-on-guidance-for-covid-19-mitigation-efforts/,Pennsylvania0006,20200509,Added DateExpiry of 20200331,https://www.governor.pa.gov/newsroom/,https://www.pa.gov/guides/responding-to-covid-19/
PA0007,561,42,PA,Pennsylvania,NEBusinessClose,1,1,1,1,20200319,20200323,,,,PA0005,,,,"Non-life sustaining businesses closure to be enacted on 20200319 at 8 pm. Was supposed to go in effect on 20200321 at 1201 am, but enforcement was delayed until 20200323 at 8 am. 20200323 is thus used as the date of enactment",https://www.governor.pa.gov/wp-content/uploads/2020/03/20200319-TWW-COVID-19-business-closure-order.pdf,"Pennsylvania0007, Pennsylvania0008",20200324,,https://www.governor.pa.gov/newsroom/,https://www.pa.gov/guides/responding-to-covid-19/
PA0037,561,42,PA,Pennsylvania,RestaurantRestrict,1,1,1,1,20200319,20200323,,,PA0006,,,,,Extends limited operations of restaurants with NE business closure.,https://www.governor.pa.gov/wp-content/uploads/2020/03/20200319-TWW-COVID-19-business-closure-order.pdf,"Pennsylvania0007, Pennsylvania0008",20200508,,https://www.governor.pa.gov/newsroom/,https://www.pa.gov/guides/responding-to-covid-19/
PA0018,561,42,PA,Pennsylvania,GathRestrictAny,1,0,0,1,20200323,20200323,20200406,,,,,,,"Initial gathering restriction activated with stay-at-home order for Allegheny County, Bucks County, Chester County, Delaware County, Monroe County, Montgomery County, and Philadelphia County.",https://www.governor.pa.gov/wp-content/uploads/2020/03/03.23.20-TWW-COVID-19-Stay-at-Home-Order.pdf,Pennsylvania0009,20200508,,https://www.governor.pa.gov/newsroom/,https://www.pa.gov/guides/responding-to-covid-19/
PA0019,561,42,PA,Pennsylvania,SchoolClose,1,1,1,1,20200323,20200323,20200406,,PA0002,,,,,"Department of Education extends school closures to at least 20200406, aligns with the initial stay-at-home order for a subset of counties",https://www.media.pa.gov/Pages/Education-Details.aspx?newsid=814,Pennsylvania0010,20200508,,https://www.governor.pa.gov/newsroom/,https://www.pa.gov/guides/responding-to-covid-19/
PA0009,561,42,PA,Pennsylvania,StayAtHome,1,0,0,1,20200323,20200323,20200406,,,,,,,"(quote) All individuals residing in Allegheny County, Bucks County, Chester County, Delaware County, Monroe County, Montgomery County, and Philadelphia County are ordered to stay at home except as needed to access, support, or provide life sustaining business, emergency, or government service (quote). In effect at 8 pm on 20200323, in effect until 20200406",https://www.governor.pa.gov/wp-content/uploads/2020/03/03.23.20-TWW-COVID-19-Stay-at-Home-Order.pdf,Pennsylvania0009,20200508,Added DateExpiry of 20200406,https://www.governor.pa.gov/newsroom/,https://www.pa.gov/guides/responding-to-covid-19/
PA0020,561,42,PA,Pennsylvania,GathRestrictAny,1,0,0,1,20200324,20200324,20200406,,,PA0018,,,,Expands initial gathering restriction to include Erie County. Maintains same expiry.,https://www.governor.pa.gov/wp-content/uploads/2020/03/2020.3.24-TWW-amendment-to-March-23-2020-COVID-19-stay-at-home-order.pdf,Pennsylvania0011,20200508,,https://www.governor.pa.gov/newsroom/,https://www.pa.gov/guides/responding-to-covid-19/
PA0010,561,42,PA,Pennsylvania,StayAtHome,1,0,0,1,20200324,20200324,20200406,,,PA0009,,,,Expands stay-at-home to include Erie County. Maintains same expiry,https://www.governor.pa.gov/wp-content/uploads/2020/03/2020.3.24-TWW-amendment-to-March-23-2020-COVID-19-stay-at-home-order.pdf,Pennsylvania0011,20200508,Added DateExpiry of 20200406,https://www.governor.pa.gov/newsroom/,https://www.pa.gov/guides/responding-to-covid-19/
PA0021,561,42,PA,Pennsylvania,GathRestrictAny,1,0,0,1,20200325,20200325,20200406,,,PA0020,,,,Expands initial gathering restriction to include to two more counties: Lehigh and Northampton. Maintains same expiry,https://www.governor.pa.gov/wp-content/uploads/2020/03/03.25.20-SOH-Stay-at-Home-Order-Amdt.pdf,Pennsylvania0012,20200508,,https://www.governor.pa.gov/newsroom/,https://www.pa.gov/guides/responding-to-covid-19/
PA0011,561,42,PA,Pennsylvania,StayAtHome,1,0,0,1,20200325,20200325,20200406,,,PA0010,,,,Expands stay at home to two more counties: Lehigh and Northampton. Maintains same expiry,https://www.governor.pa.gov/wp-content/uploads/2020/03/03.25.20-SOH-Stay-at-Home-Order-Amdt.pdf,Pennsylvania0012,20200508,Added DateExpiry of 20200406,https://www.governor.pa.gov/newsroom/,https://www.pa.gov/guides/responding-to-covid-19/
PA0022,561,42,PA,Pennsylvania,GathRestrictAny,1,0,0,1,20200327,20200327,20200406,,,PA0021,,,,"Expands gathering restriction to more counties: Berks, Butler, Lackawanna, Lancaster, Luzerne, Pike, Wayne, Westmoreland, and York Counties. Maintains same expiry",https://www.governor.pa.gov/wp-content/uploads/2020/03/20200327-GOV-Stay-at-Home-Order-Amended.pdf,Pennsylvania0013,20200508,,https://www.governor.pa.gov/newsroom/,https://www.pa.gov/guides/responding-to-covid-19/
PA0012,561,42,PA,Pennsylvania,StayAtHome,1,0,0,1,20200327,20200327,20200406,,,PA0011,,,,"Expands to more counties to stay-at-home order - Berks, Butler, Lackawanna, Lancaster, Luzerne, Pike, Wayne, Westmoreland, and York Counties. Maintains same expiry",https://www.governor.pa.gov/wp-content/uploads/2020/03/20200327-GOV-Stay-at-Home-Order-Amended.pdf,Pennsylvania0013,20200508,Added DateExpiry of 20200406,https://www.governor.pa.gov/newsroom/,https://www.pa.gov/guides/responding-to-covid-19/
PA0023,561,42,PA,Pennsylvania,GathRestrictAny,1,0,0,1,20200328,20200328,20200406,,,PA0022,,,,"Expands gathering restriction to more counties: Beaver, Centre and Washington Counties. Maintains same expiry",https://www.governor.pa.gov/newsroom/governor-wolf-and-health-secretary-expand-stay-at-home-order-to-beaver-centre-and-washington-counties-to-mitigate-spread-of-covid-19-counties-now-total-22/,Pennsylvania0014,20200508,,https://www.governor.pa.gov/newsroom/,https://www.pa.gov/guides/responding-to-covid-19/
PA0013,561,42,PA,Pennsylvania,StayAtHome,1,0,0,1,20200328,20200328,20200406,,,PA0012,,,,"Expands to more counties to stay-at-home order - Beaver, Centre and Washington Counties. Maintains same expiry",https://www.governor.pa.gov/newsroom/governor-wolf-and-health-secretary-expand-stay-at-home-order-to-beaver-centre-and-washington-counties-to-mitigate-spread-of-covid-19-counties-now-total-22/,Pennsylvania0014,20200331,Added expiry date,https://www.governor.pa.gov/newsroom/,https://www.pa.gov/guides/responding-to-covid-19/
PA0024,561,42,PA,Pennsylvania,GathRestrictAny,1,0,0,1,20200330,20200330,20200430,,PA0023,PA0023,,,,"Expands gathering restriction to more counties: Carbon, Cumberland, Dauphin, and Schuylkill. Commences at 8 pm 20200330, extends to 20200430",https://www.governor.pa.gov/wp-content/uploads/2020/03/20200330-GOV-Stay-at-Home-Order-Amendment.pdf,Pennsylvania0015,20200508,,https://www.governor.pa.gov/newsroom/,https://www.pa.gov/guides/responding-to-covid-19/
