location_id,StateFIPS,StatePostal,StateName,StatePolicy,Mandate,DateIssued,DateEnacted,DateExpiry,DateEnded,PolicyCodingNotes,PolicySource,StateWide,LastUpdated,LastUpdatedNotes,,,,,,
563,45,SC,South Carolina,SchoolClose,1,20200324,20200324,,,Schools to remain closed through the month of April,https://governor.sc.gov/sites/default/files/Documents/Executive-Orders/2020-03-28%20eFILED%20Executive%20Order%20No.%202020-15%20-%20State%20of%20Emergency%20Due%20to%20COVID-19%20Pandemic.pdf,1,20200327,,,,,,,
563,45,SC,South Carolina,StayAtHome,1,20200324,20200326,,,"Only applicable to Charleston SC, not statewide",https://www.charleston-sc.gov/DocumentCenter/View/26251/Emergency-Ordinance-Stay-at-Home,0,20200329,,,,,,,
563,45,SC,South Carolina,Quarantine,1,20200327,20200327,,,"Mandates 14 day quarantine on people entering from New York, New Jersey, Connecticut, and New Orleans, Louisiana. Expires when emergency order expires",https://governor.sc.gov/sites/default/files/Documents/Executive-Orders/2020-03-27%20eFILED%20Executive%20Order%20No.%202020-14%20-%20Self-Quarantine%20for%20Individuals%20from%20High-Risk%20Areas.pdf,1,20200412,"Clarified that quarantine is required for individuals traveling from New Orleans, Louisiana not all of Louisiana",,,,,,
563,45,SC,South Carolina,OtherBusinessClose,1,20200331,20200331,,,"Closes additional non-essential businesses but does not go to full NEBusinessClose. Businesses groups listed for closure are entertainment venues and facilities, recreational and athletic facilities, and close contact service providers.",https://governor.sc.gov/sites/default/files/Documents/Executive-Orders/2020-03-31%20eFILED%20Executive%20Order%20No.%202020-17%20-%20Closure%20of%20Non-Essential%20Businesses.pdf,1,20200331,,,,,,,
563,45,SC,South Carolina,OtherBusinessClose,1,20200403,20200406,,,"Closes additional non-essential businesses, specifically retail stores. In effect on 20200406 at 5 pm",https://governor.sc.gov/sites/default/files/Documents/Executive-Orders/2020-04-03%20eFILED%20Executive%20Order%20No.%202020-18%20-%20Closure%20of%20Additional%20Non-Essential%20Businesses.pdf,1,20200412,,,,,,,
563,45,SC,South Carolina,StayAtHome,1,20200406,20200407,,,Allows for attending religious services. Enacted 20200407 at 5pm and stays in effect for the duration of the State of Emergency,https://governor.sc.gov/sites/default/files/Documents/Executive-Orders/2020-04-06%20eFILED%20Executive%20Order%20No.%202020-21%20-%20Stay%20at%20Home%20or%20Work%20Order.pdf,1,20200406,,,,,,,
564,46,SD,South Dakota,EmergDec,1,20200313,20200313,,,State of Emergency declared with Executive Order 2020-04,https://www.fmcsa.dot.gov/emergency/south-dakota-general-executive-orders-2020-004,1,20200324,,,,,,,
564,46,SD,South Dakota,SchoolClose,1,20200313,20200317,,,"Remain closed for another week. governor issued on 20200313, closure started 2020317",https://www.youtube.com/watch?v=NIjuy-HlICw,1,20200324,,,,,,,
564,46,SD,South Dakota,GathRecomAny,0,20200323,20200323,20200502,,Applies per the enclosed retail business that promotes public gatherings - recommendation to suspend or modify operations as recommended by CDC that involved 10 or more people to be enclosed in a small space,https://sdsos.gov/general-information/executive-actions/executive-orders/assets/2020-08.PDF,1,20200412,Added expiry date,,,,,,
564,46,SD,South Dakota,EmergDec,1,20200402,20200402,,,State of Disaster declared for all 66 counties,https://sdsos.gov/general-information/executive-actions/executive-orders/assets/2020-11.PDF,1,20200412,,,,,,,
564,46,SD,South Dakota,StayAtHome,1,20200406,20200406,20200427,,"Only applies to Minnehaha and Lincoln counties, and focuses on vulnerable individuals (i.e., adults 65 or older and those with serious medical conditions) ",https://sdsos.gov/general-information/executive-actions/executive-orders/assets/2020-13.PDF,0,20200412,,,,,,,
564,46,SD,South Dakota,GathRestrictAny,1,20200406,20200406,20200531,,First formal gathering restriction now coded with issuance of 10+ ban,https://sdsos.gov/general-information/executive-actions/executive-orders/assets/2020-12.PDF,1,20200407,,,,,,,
564,46,SD,South Dakota,GathRestrict10,1,20200406,20200406,20200531,,,https://sdsos.gov/general-information/executive-actions/executive-orders/assets/2020-12.PDF,1,20200407,,,,,,,
565,47,TN,Tennessee,EmergDec,1,20200312,20200312,20200511,,Declared state of emergency. Initial expiry is set to be 1201 am 20200511,https://publications.tnsosfiles.com/pub/execorders/exec-orders-lee14.pdf,1,20200412,Added expiry date,,,,,,
565,47,TN,Tennessee,GathRecomAny,0,20200312,20200312,,,(quote) Vulnerable populations should stay home where possible and avoid large gatherings or locations where they are more likely to contract the virus (quote),https://www.tn.gov/governor/news/2020/3/12/gov--bill-lee-issues-executive-order-declaring-state-of-emergency-in-response-to-covid-19.html,0,20200412,Recoded StateWide to 0 since it was focused on a subpopulation (vulnerable populations),,,,,,
565,47,TN,Tennessee,GathRestrict10,1,20200322,20200323,,,In effect at 1201 am on 20200323. Initial expiry was to be set at 1201 am 20200406,https://sos-tn-gov-files.tnsosfiles.com/forms/exec-order-lee17.pdf,1,20200324,,,,,,,
565,47,TN,Tennessee,GathRestrictAny,1,20200322,20200323,,,In effect at 1201 am on 20200323. Initial expiry was to be set at 1201 am 20200406,https://sos-tn-gov-files.tnsosfiles.com/forms/exec-order-lee17.pdf,1,20200324,,,,,,,
565,47,TN,Tennessee,OtherBusinessClose,1,20200322,20200323,,,"Closure required: gyms, fitness/exercise centers. In effect at 1201 am on 20200323. Initial expiry was to be set at 1201 am 20200406",https://sos-tn-gov-files.tnsosfiles.com/forms/exec-order-lee17.pdf,1,20200324,,,,,,,
565,47,TN,Tennessee,RestaurantRestrict,1,20200322,20200323,,,"Limited operations (take-out, delivery, off-site consumption only): restaurants, bars. In effect at 1201 am on 20200323. Initial expiry was to be set at 1201 am 20200406",https://sos-tn-gov-files.tnsosfiles.com/forms/exec-order-lee17.pdf,1,20200324,,,,,,,
565,47,TN,Tennessee,SchoolClose,0,,,,,"On 20200313 schools given discretion, reinforced 20200317. Current not counting as a required closure.",https://www.tn.gov/governor/news/2020/3/16/governor-lee-issues-statement-regarding-statewide-school-closure.html,0,20200324,,,,,,,
565,47,TN,Tennessee,SchoolClose,0,20200325,20200325,,,"On 20200325 governor continues to urge public school closures, but still no apparent issuance of a mandate. Confirmed by state education site: https://www.tn.gov/education/health-and-safety/update-on-coronavirus.html",https://www.newschannel5.com/news/gov-lee-asks-tennessee-public-schools-to-remain-closed-until-april-24,0,20200326,,,,,,,
565,47,TN,Tennessee,StayAtHome,,,,,,"Stay at home recommendations or issuances only in counties, implemented at different dates",,0,20200329,,,,,,,
565,47,TN,Tennessee,OtherBusinessClose,1,20200330,20200330,20200415,,"Closure of close-personal contact personal services, as well as entertainment and recreational gathering places such as night clubs, concert venues, theaters, etc. In effect through 1159 pm 20200414, so expires 20200415. Considered an amendment to the 20200322 order",https://publications.tnsosfiles.com/pub/execorders/exec-orders-lee21.pdf,1,20200412,,,,,,,
565,47,TN,Tennessee,StayAtHome,0,20200330,20200401,20200415,,"(quote) all persons in Tennessee are urged to say at home (quote). Not currently coded as StayAtHome mandate. Expiry is 20200414 at 1159 pm, should be coded as 20200415",https://publications.tnsosfiles.com/pub/execorders/exec-orders-lee22.pdf,1,20200412,Updated expiry to 20200415 since it expires on 20200414 at 1159 pm,,,,,,
565,47,TN,Tennessee,NEBusinessClose,1,20200330,20200401,20200415,,"(quote) businesses or organizations that do not perform Essential Duties shall not be open for access or use (quote). Also see point 30, business activities required to maintain inventory still permitted. Expiry is 20200414 at 1159 pm, should be coded as 20200415",https://publications.tnsosfiles.com/pub/execorders/exec-orders-lee22.pdf,1,20200412,Updated expiry to 20200415 since it expires on 20200414 at 1159 pm,,,,,,
565,47,TN,Tennessee,StayAtHome,1,20200402,20200402,20200415,,All persons in TN required to stay home (replaces language from paragraph 1 from Exec order 22 issued March 30). Expiry date at midnight on April 14.,https://publications.tnsosfiles.com/pub/execorders/exec-orders-lee23.pdf,1,20200402,,,,,,,
566,48,TX,Texas,EmergDec,1,20200313,20200313,,,State of Disaster Declared,https://gov.texas.gov/uploads/files/press/DISASTER_covid19_disaster_proclamation_IMAGE_03-13-2020.pdf,1,20200324,,,,,,,
566,48,TX,Texas,GathRestrict10,1,20200319,20200321,20200404,,"In effect statewide at 1159 pm on 20200320, coded to 20200321. Initial expiry is set to be 1159 pm 20200403, coded to 20200404",https://gov.texas.gov/uploads/files/press/EO-GA_08_COVID-19_preparedness_and_mitigation_FINAL_03-19-2020_1.pdf,1,20200412,Updated DateEnact to 20200321 since it went in effect at 1159 pm on 20200320. Added initial expiry of 20200404 since its expiry was 20200403 at 1159 pm,,,,,,
566,48,TX,Texas,GathRestrictAny,1,20200319,20200321,20200404,,"In effect statewide at 1159 pm on 20200320, coded to 20200321. Initial expiry is set to be 1159 pm 20200403, coded to 20200404",https://gov.texas.gov/uploads/files/press/EO-GA_08_COVID-19_preparedness_and_mitigation_FINAL_03-19-2020_1.pdf,1,20200412,Updated DateEnact to 20200321 since it went in effect at 1159 pm on 20200320. Added initial expiry of 20200404 since its expiry was 20200403 at 1159 pm,,,,,,
566,48,TX,Texas,OtherBusinessClose,1,20200319,20200321,20200404,,"Closure required: gyms, massage parlors. In effect statewide at 1159 pm on 20200320, coded to 20200321. Initial expiry is set to be 1159 pm 20200403, coded to 20200404",https://gov.texas.gov/uploads/files/press/EO-GA_08_COVID-19_preparedness_and_mitigation_FINAL_03-19-2020_1.pdf,1,20200412,Updated DateEnact to 20200321 since it went in effect at 1159 pm on 20200320. Added initial expiry of 20200404 since its expiry was 20200403 at 1159 pm,,,,,,
566,48,TX,Texas,RestaurantRestrict,1,20200319,20200321,20200404,,"Limited operations required (drive-thru, pickup, delivery): restaurants and bars. In effect statewide at 1159 pm on 20200320, coded to 20200321. Initial expiry is set to be 1159 pm 20200403, coded to 20200404",https://gov.texas.gov/uploads/files/press/EO-GA_08_COVID-19_preparedness_and_mitigation_FINAL_03-19-2020_1.pdf,1,20200412,Updated DateEnact to 20200321 since it went in effect at 1159 pm on 20200320. Added initial expiry of 20200404 since its expiry was 20200403 at 1159 pm,,,,,,
566,48,TX,Texas,SchoolClose,1,20200319,20200321,20200404,,"In effect statewide at 1159 pm on 20200320, coded to 20200321. Initial expiry is set to be 1159 pm 20200403, coded to 20200404. On 20200331 with StayAtHome order, Expiry date extended to 20200504",https://gov.texas.gov/uploads/files/press/EO-GA_08_COVID-19_preparedness_and_mitigation_FINAL_03-19-2020_1.pdf,1,20200412,Updated DateEnact to 20200321 since it went in effect at 1159 pm on 20200320. Added initial expiry of 20200404 since its expiry was 20200403 at 1159 pm,,,,,,
566,48,TX,Texas,Quarantine,1,20200326,20200328,,,"Mandates 14 day quarantine on individuals entering Texas whose point of origin or last departure was New York, New Jersey, Connecticut, or City of New Orleans",https://gov.texas.gov/uploads/files/press/EO-GA-11_airport_travel_reporting_COVID-19_IMAGE_03-26-2020.pdf,1,20200412,,,,,,,
566,48,TX,Texas,StayAtHome,,,,,,"Currently left to county officials at variable times. Includes large counties like Harris, where Houston is, and Dallas.",,0,20200329,,,,,,,
566,48,TX,Texas,StayAtHome,1,20200331,20200402,20200430,,"Requires Texans to stay at home except for essential activities (including everything listed by the U.S. Department of Homeland Security, plus religious services)",https://gov.texas.gov/news/post/governor-abbott-issues-executive-order-implementing-essential-services-and-activities-protocols,1,20200402,,,,,,,
566,48,TX,Texas,Quarantine,1,20200329,20200330,,,"Mandates 14 day quarantine on people arriving from the states of California, Louisiana, Washington and the cities of Atlanta Georgia, Chicago Illinois, Detroit Michigan, and Miami Florida. Expires when the executive order expires",https://gov.texas.gov/uploads/files/press/DISASTER_COVID19_disaster_air_travel_restric_adds_IMAGE_03-29-2020.pdf,1,20200412,Clarified states and cities covered by this order,,,,,,
566,48,TX,Texas,Quarantine,1,20200329,20200330,,,Mandates 14 day quarantine on all people arriving in Texas by roadways from Lousiana,https://lrl.texas.gov/scanned/govdocs/Greg%20Abbott/2020/GA-12.pdf,1,20200408,,,,,,,
567,49,UT,Utah,EmergDec,1,20200306,20200306,,,,https://coronavirus.utah.gov/governor-issues-executive-order-declaring-a-state-of-emergency-in-preparation-for-cases-of-novel-coronavirus-in-utah/,1,20200324,,,,,,,
567,49,UT,Utah,GathRecomAny,0,20200312,20200316,,,"Recommendation to ban all gatherings 100 or more. Was originally coded as a ban, formal restriction based on previous documentation. On 20200412 revised to GathRecomAny and dropped GathRestrictAny",https://governor.utah.gov/2020/03/16/gov-herbert-announces-recommendations-to-help-slow-the-spread-of-novel-coronavirus-2/,1,20200412,Revised StatePolicy type to GathRecomAny per updated documentation. Also deleted record for GathRestrict100,,,,,,
567,49,UT,Utah,SchoolClose,1,20200313,20200316,,,"Dismissal of all schools as soft closure to start 20200316, issued on 20200313",https://governor.utah.gov/2020/03/13/gov-herbert-announces-two-week-dismissal-of-utahs-public-schools/,1,20200324,,,,,,,
567,49,UT,Utah,GathRestrictAny,1,20200317,20200318,,,Gather restriction any is activated for gather restriction for 10 or more,https://governor.utah.gov/2020/03/18/state-orders-restaurants-bars-to-suspend-dine-in-services-to-slow-spread-of-covid-19/,1,20200412,Revised policy source and dates for GathRestrictAny. Had been first coded with recommendation to ban gatherings of 10.,,,,,,
567,49,UT,Utah,GathRestrict10,1,20200317,20200318,,,"On 20200321, order was amended to remove potential criminal association for gathering restriction https://coronavirus.utah.gov/state-clarifies-mass-gathering-instructions/",https://governor.utah.gov/2020/03/18/state-orders-restaurants-bars-to-suspend-dine-in-services-to-slow-spread-of-covid-19/,1,20200324,,,,,,,
567,49,UT,Utah,RestaurantRestrict,1,20200317,20200319,,,"Limited operations required (suspend dine-in operations): restaurants, bars. Goes into effect on 1159 pm 20200318, coded to 2020031. Expanded State public health order issued on 20200401 https://drive.google.com/file/d/1PH2tbSfCvKjtw7LG1PgqhPclCaqiu-q6/view",https://governor.utah.gov/2020/03/18/state-orders-restaurants-bars-to-suspend-dine-in-services-to-slow-spread-of-covid-19/,1,20200412,Updated DateEnact to 20200319 since it went in effect at 1159 pm on 20200318,,,,,,
567,49,UT,Utah,SchoolClose,1,20200323,20200324,,,Public schools to remained closed through May 2,https://governor.utah.gov/2020/03/24/state-issues-extension-on-k-12-and-technical-college-dismissal/,1,20200327,,,,,,,
567,49,UT,Utah,StayAtHome,1,20200325,20200327,20200501,,Only applicable to Summit County - not statewide,https://www.summitcounty.org/DocumentCenter/View/10751/Joint-Public-Health-Order-2020-03-FINAL,0,20200329,,,,,,,
567,49,UT,Utah,StayAtHome,0,20200327,20200327,20200413,,(quote) these directives are not to be confused with a shelter-in-place order (quote) ,https://drive.google.com/file/d/1Qey2xIxAEqIxiiAHJyHSxBosmjetkbN7/view,1,20200412,,,,,,,
568,50,VT,Vermont,EmergDec,1,20200313,20200313,,,Initial date of expiry is 20200415,https://governor.vermont.gov/sites/scott/files/documents/EO%2001-20%20Declaration%20of%20State%20of%20Emergency%20in%20Response%20to%20COVID-19%20and%20National%20Guard%20Call-Out.pdf,1,20200324,,,,,,,
568,50,VT,Vermont,GathRestrict250,1,20200313,20200313,,,Initial date of expiry is 20200415,https://governor.vermont.gov/sites/scott/files/documents/EO%2001-20%20Declaration%20of%20State%20of%20Emergency%20in%20Response%20to%20COVID-19%20and%20National%20Guard%20Call-Out.pdf,1,20200324,,,,,,,
568,50,VT,Vermont,GathRestrictAny,1,20200313,20200313,,,Initial date of expiry is 20200415,https://governor.vermont.gov/sites/scott/files/documents/EO%2001-20%20Declaration%20of%20State%20of%20Emergency%20in%20Response%20to%20COVID-19%20and%20National%20Guard%20Call-Out.pdf,1,20200324,,,,,,,
568,50,VT,Vermont,SchoolClose,1,20200315,20200318,20200612,,"Will close in 3 days time (i.e., 20200318). Extended to the end of the school year, ie 20200612.",https://governor.vermont.gov/sites/scott/files/documents/Directive%202%20-%20Childcare%20For%20Essential%20Service%20Providers.pdf,1,20200412,added expiry,,,,,,
568,50,VT,Vermont,GathRestrict50,1,20200316,20200317,,,Only permits 50 or 50% of permitted occupancy (whichever is less). In effect at 2 pm as of 20200317. Initial expiry is 20200406,https://governor.vermont.gov/sites/scott/files/documents/ADDENDUM%202%20TO%20EXECUTIVE%20ORDER%2001-20_0.pdf,1,20200324,,,,,,,
568,50,VT,Vermont,RestaurantRestrict,1,20200316,20200317,20200515,,"Limited operations required (takeout and delivery only): restaurants, bars. In effect at 2 pm as of 20200317. Initial expiry is 20200406. Expiry extended to 20200515.",https://governor.vermont.gov/sites/scott/files/documents/ADDENDUM%202%20TO%20EXECUTIVE%20ORDER%2001-20_0.pdf,1,20200412,Added expiry,,,,,,
568,50,VT,Vermont,GathRestrict10,1,20200320,20200320,20200515,,Goes into effect unless otherwise specified at signing. Through 20200415 unless amended or extended. Extended to 20200515.,https://governor.vermont.gov/sites/scott/files/documents/ADDENDUM%204%20TO%20EXECUTIVE%20ORDER%2001-20.pdf,1,20200412,Added expiry,,,,,,
568,50,VT,Vermont,OtherBusinessClose,1,20200320,20200323,20200515,,"Closure required: gymnasiums, fitness centers, salons as of 8 pm on 20200323. Through 20200415 unless amended or extended.  Extended to 20200515",https://governor.vermont.gov/sites/scott/files/documents/ADDENDUM%204%20TO%20EXECUTIVE%20ORDER%2001-20.pdf,1,20200412,Added expiry,,,,,,
568,50,VT,Vermont,NEBusinessClose,1,20200324,20200325,20200415,,"With detailed exceptions, (quote) all businesses and non-profit entities in the state shall suspend in-person operations (quote)",https://governor.vermont.gov/sites/scott/files/documents/ADDENDUM%206%20TO%20EXECUTIVE%20ORDER%2001-20.pdf,1,20200329,Added expiry,,,,,,
568,50,VT,Vermont,StayAtHome,1,20200324,20200324,20200415,,"Enacted upon signing, since a later enactment was not indicated like NEBusiness (quote) Vermonters are directed to stay at home or in their place of residence, leaving only for essential reasons (quote)",https://governor.vermont.gov/sites/scott/files/documents/ADDENDUM%206%20TO%20EXECUTIVE%20ORDER%2001-20.pdf,1,20200329,Added expiry,,,,,,
568,50,VT,Vermont,Quarantine,1,20200330,20200330,20200415,,"Mandates 14 day quarantine on everyone arriving in Vermont from other states, including returning Vermonters",https://governor.vermont.gov/sites/scott/files/documents/ADDENDUM%207%20TO%20EXECUTIVE%20ORDER%2001-20.pdf,1,20200331,,,,,,,
569,51,VA,Virginia,EmergDec,1,20200312,20200312,20200610,,State of Emergency declaration. Expiry is 20200610 unless amended or extended,https://www.governor.virginia.gov/media/governorvirginiagov/governor-of-virginia/pdf/eo/EO-51-Declaration-of-a-State-of-Emergency-Due-to-Novel-Coronavirus-(COVID-19).pdf,1,20200412,Added expiry date,,,,,,
569,51,VA,Virginia,SchoolClose,1,20200313,20200316,,,,https://www.governor.virginia.gov/newsroom/all-releases/2020/march/headline-854442-en.html,1,20200324,,,,,,,
569,51,VA,Virginia,GathRestrict100,1,20200315,20200315,,,,https://www.nbc12.com/2020/03/15/northam-bans-gatherings-people-says-its-not-yet-time-quarantine/,1,20200324,,,,,,,
569,51,VA,Virginia,GathRestrictAny,1,20200315,20200315,,,,https://www.nbc12.com/2020/03/15/northam-bans-gatherings-people-says-its-not-yet-time-quarantine/,1,20200324,,,,,,,
569,51,VA,Virginia,RestaurantRestrict,1,20200317,20200317,,,"Mandated to reduce capacity to 10 patrons or close, or have carry-out or take-away",https://www.governor.virginia.gov/media/governorvirginiagov/executive-actions/Amended-Order-of-the-Governor-and-State-Health-Commissioner-Declaration-of-Public-Health-Emergency.pdf,1,20200325,,,,,,,
569,51,VA,Virginia,GathRestrict10,1,20200323,20200325,20200424,,"In effect at 1159 pm on 2020034, coded to 20200325 enactment. Initial expiry is 20200423 at 1159 pm, so 20200424",https://www.governor.virginia.gov/media/governorvirginiagov/executive-actions/EO-53-Temporary-Restrictions-Due-To-Novel-Coronavirus-(COVID-19).pdf,1,20200412,"Updated DateEnact to 20200325 due its enactment at 1159 pm on 20200324, added initial expiry",,,,,,
569,51,VA,Virginia,OtherBusinessClose,1,20200323,20200325,20200424,,"Closure required: public access to recreational and entertainment businesses, personal care and personal grooming services, racetracks, etc. Initial expiry is 20200423 at 1159 pm, so 20200424",https://www.governor.virginia.gov/media/governorvirginiagov/executive-actions/EO-53-Temporary-Restrictions-Due-To-Novel-Coronavirus-(COVID-19).pdf,1,20200412,"Updated DateEnact to 20200325 due its enactment at 1159 pm on 20200324, added initial expiry",,,,,,
569,51,VA,Virginia,RestaurantRestrict,1,20200323,20200325,20200424,,"Limited operations required (delivery and take-out only): restaurants, bars. Now no restricted in-person service allowed at all. Initial expiry is 20200423 at 1159 pm, so 20200424",https://www.governor.virginia.gov/media/governorvirginiagov/executive-actions/EO-53-Temporary-Restrictions-Due-To-Novel-Coronavirus-(COVID-19).pdf,1,20200412,"Updated DateEnact to 20200325 due its enactment at 1159 pm on 20200324, added initial expiry",,,,,,
569,51,VA,Virginia,StayAtHome,1,20200330,20200330,20200610,,"Also further strengthens ban on 10+ gatherings, all school closures",https://www.governor.virginia.gov/media/governorvirginiagov/executive-actions/EO-55-Temporary-Stay-at-Home-Order-Due-to-Novel-Coronavirus-(COVID-19).pdf,1,20200330,,,,,,,
570,53,WA,Washington,EmergDec,1,20200229,20200229,,,State of Emergency. Does not include a formal expiry date,https://www.governor.wa.gov/sites/default/files/20-05%20Coronavirus%20%28final%29.pdf?utm_medium=email&utm_source=govdelivery,1,20200324,,,,,,,
570,53,WA,Washington,GathRestrict250,1,20200311,20200311,,,"Only applicable to King, Pierce, and Snohomish Counties. Initial expiry was midnight on 20200331, so formal expiry would have been 20200401 per coding criteria",https://www.governor.wa.gov/sites/default/files/20-07%20Coronavirus%20%28tmp%29.pdf,0,20200412,"Updated StateWide to equal 0 as this order was only applied to King, Pierce, and Snohomish counties",,,,,,
570,53,WA,Washington,GathRestrictAny,1,20200311,20200311,,,"Only applicable to King, Pierce, and Snohomish Counties. Initial expiry was midnight on 20200331, so formal expiry would have been 20200401 per coding criteria",https://www.governor.wa.gov/sites/default/files/20-07%20Coronavirus%20%28tmp%29.pdf,0,20200412,"Updated StateWide to equal 0 as this order was only applied to King, Pierce, and Snohomish counties",,,,,,
570,53,WA,Washington,SchoolClose,1,20200312,20200317,20200424,,"Closes all schools K-12 (public, private, and charter) for King, Pierce, and Snohomish counties. Goes in effect 1201 am 20200317, through 20200424 at 12 pm (unless extended). ",https://www.governor.wa.gov/sites/default/files/proclamations/20-08%20Coronavirus%20%28tmp%29.pdf,0,20200412,,,,,,,
570,53,WA,Washington,SchoolClose,1,20200313,20200317,20200424,,"Statewide closure of all public, private, and charter schools comes into effect 1201 am on 20200317, through 20200424 at 12 pm for initial expiry. A separate order closes all colleges on the same day (20200313) https://www.governor.wa.gov/sites/default/files/proclamations/20-12%20Coronavirus%20College%20Closure%20%28tmp%29.pdf  Extension issued on 20200406, through 20200619 https://www.governor.wa.gov/sites/default/files/proclamations/20-09.1%20-%20COVID-19%20School%20Closure%20Extension%20%28tmp%29.pdf ",https://www.governor.wa.gov/sites/default/files/proclamations/20-09%20Coronavirus%20Schools%20Amendment%20%28tmp%29.pdf,1,20200412,Added initial expiry and linked to PolicySource,,,,,,
570,53,WA,Washington,GathRestrictAny,1,20200313,20200313,,,"Applies 250 gathering limit to all Washington state counties. Initial expiry was midnight on 20200331, so formal expiry would have been 20200401 per coding criteria",https://www.governor.wa.gov/sites/default/files/proclamations/20-11%20Coronavirus%20Gatherings%20Amendment%20%28tmp%29.pdf,1,20200412,,,,,,,
570,53,WA,Washington,GathRestrict250,1,20200313,20200313,,,"Applies 250 gathering limit to all Washington state counties. Initial expiry was midnight on 20200331, so formal expiry would have been 20200401 per coding criteria",https://www.governor.wa.gov/sites/default/files/proclamations/20-11%20Coronavirus%20Gatherings%20Amendment%20%28tmp%29.pdf,1,20200412,,,,,,,
570,53,WA,Washington,GathRestrict50,1,20200316,20200316,,,"In effect until midnight on 20200331, so formal expiry wouldh have been 20200401",https://www.governor.wa.gov/sites/default/files/proclamations/20-14%20COVID-19%20-%20Prohibitions%20on%20Gatherings%20%28tmp%29.pdf,1,20200324,,,,,,,
